{
  "schema_version": "1.0.0",
  "tool": {
    "tool_id": "claude_code",
    "name": "Claude Code"
  },
  "research": {
    "run_id": "research-20261011-113010-0533393a",
    "researched_at": "2026-10-11T11:46:24Z",
    "taxonomy_revision": 7,
    "template_revision": 1,
    "source_policy_revision": 1,
    "profile_state": "current"
  },
  "sources": [
    {
      "source_id": "anthropic_commercial_terms",
      "url": "https://www.anthropic.com/legal/commercial-terms",
      "title": "Commercial Terms of Service",
      "source_type": "documentation",
      "checked_at": "2026-10-11",
      "available": true,
      "official": true
    },
    {
      "source_id": "anthropic_data_processing_addendum",
      "url": "https://www.anthropic.com/legal/data-processing-addendum",
      "title": "Data Processing Addendum",
      "source_type": "documentation",
      "checked_at": "2026-10-11",
      "available": true,
      "official": true
    },
    {
      "source_id": "anthropic_data_residency",
      "url": "https://platform.claude.com/docs/en/manage-claude/data-residency",
      "title": "Data residency",
      "source_type": "documentation",
      "checked_at": "2026-10-11",
      "available": true,
      "official": true
    },
    {
      "source_id": "anthropic_subprocessors",
      "url": "https://trust.anthropic.com/subprocessors",
      "title": "Anthropic Trust Center",
      "source_type": "documentation",
      "checked_at": "2026-10-11",
      "available": false,
      "official": true,
      "redirect_from": "https://www.anthropic.com/subprocessors"
    },
    {
      "source_id": "claude_code_agent_view",
      "url": "https://code.claude.com/docs/en/agent-view",
      "title": "Manage multiple agents with agent view",
      "source_type": "documentation",
      "checked_at": "2026-10-11",
      "available": true,
      "official": true
    },
    {
      "source_id": "claude_code_analytics",
      "url": "https://code.claude.com/docs/en/analytics",
      "title": "Track team usage with analytics",
      "source_type": "documentation",
      "checked_at": "2026-10-11",
      "available": true,
      "official": true
    },
    {
      "source_id": "claude_code_authentication",
      "url": "https://code.claude.com/docs/en/authentication",
      "title": "Authentication",
      "source_type": "documentation",
      "checked_at": "2026-10-11",
      "available": true,
      "official": true
    },
    {
      "source_id": "claude_code_checkpointing",
      "url": "https://code.claude.com/docs/en/checkpointing",
      "title": "Checkpointing",
      "source_type": "documentation",
      "checked_at": "2026-10-11",
      "available": true,
      "official": true
    },
    {
      "source_id": "claude_code_chrome",
      "url": "https://code.claude.com/docs/en/chrome",
      "title": "Use Claude Code with Chrome",
      "source_type": "documentation",
      "checked_at": "2026-10-11",
      "available": true,
      "official": true
    },
    {
      "source_id": "claude_code_cli_reference",
      "url": "https://code.claude.com/docs/en/cli-reference",
      "title": "CLI reference",
      "source_type": "documentation",
      "checked_at": "2026-10-11",
      "available": true,
      "official": true
    },
    {
      "source_id": "claude_code_cloud_access",
      "url": "https://code.claude.com/docs/en/claude-code-on-the-web",
      "title": "Use Claude Code in the cloud",
      "source_type": "documentation",
      "checked_at": "2026-10-11",
      "available": true,
      "official": true
    },
    {
      "source_id": "claude_code_cloud_quickstart",
      "url": "https://code.claude.com/docs/en/web-quickstart",
      "title": "Get started with Claude Code in the cloud",
      "source_type": "documentation",
      "checked_at": "2026-10-11",
      "available": true,
      "official": true
    },
    {
      "source_id": "claude_code_cloud_sessions",
      "url": "https://code.claude.com/docs/en/claude-code-on-the-web",
      "title": "Use Claude Code in the cloud",
      "source_type": "documentation",
      "checked_at": "2026-10-11",
      "available": true,
      "official": true
    },
    {
      "source_id": "claude_code_code_intelligence",
      "url": "https://code.claude.com/docs/en/plugins/code-intelligence",
      "title": "Code intelligence plugins",
      "source_type": "documentation",
      "checked_at": "2026-10-11",
      "available": true,
      "official": true
    },
    {
      "source_id": "claude_code_common_workflows",
      "url": "https://code.claude.com/docs/en/common-workflows",
      "title": "Common workflows",
      "source_type": "documentation",
      "checked_at": "2026-10-11",
      "available": true,
      "official": true
    },
    {
      "source_id": "claude_code_costs",
      "url": "https://code.claude.com/docs/en/costs",
      "title": "Manage costs effectively",
      "source_type": "documentation",
      "checked_at": "2026-10-11",
      "available": true,
      "official": true
    },
    {
      "source_id": "claude_code_data_usage",
      "url": "https://code.claude.com/docs/en/data-usage",
      "title": "Data usage",
      "source_type": "documentation",
      "checked_at": "2026-10-11",
      "available": true,
      "official": true
    },
    {
      "source_id": "claude_code_desktop_scheduled_tasks",
      "url": "https://code.claude.com/docs/en/desktop-scheduled-tasks",
      "title": "Schedule recurring tasks in Claude Code Desktop",
      "source_type": "documentation",
      "checked_at": "2026-10-11",
      "available": true,
      "official": true
    },
    {
      "source_id": "claude_code_docs_changelog",
      "url": "https://code.claude.com/docs/en/changelog",
      "title": "Claude Code changelog",
      "source_type": "changelog",
      "checked_at": "2026-10-11",
      "available": true,
      "official": true
    },
    {
      "source_id": "claude_code_docs_overview",
      "url": "https://code.claude.com/docs/en/overview",
      "title": "Overview",
      "source_type": "documentation",
      "checked_at": "2026-10-11",
      "available": true,
      "official": true
    },
    {
      "source_id": "claude_code_dynamic_workflows_article",
      "url": "https://claude.dev/blog/a-harness-for-every-task-dynamic-workflows-in-claude-code/",
      "title": "A harness for every task",
      "source_type": "specialist",
      "checked_at": "2026-10-11",
      "available": true,
      "official": true,
      "redirect_from": "https://claude.com/blog/a-harness-for-every-task-dynamic-workflows-in-claude-code"
    },
    {
      "source_id": "claude_code_enterprise_deployment",
      "url": "https://code.claude.com/docs/en/third-party-integrations",
      "title": "Enterprise deployment overview",
      "source_type": "documentation",
      "checked_at": "2026-10-11",
      "available": true,
      "official": true
    },
    {
      "source_id": "claude_code_feature_availability",
      "url": "https://code.claude.com/docs/en/feature-availability",
      "title": "Feature availability",
      "source_type": "documentation",
      "checked_at": "2026-10-11",
      "available": true,
      "official": true
    },
    {
      "source_id": "claude_code_github_actions",
      "url": "https://code.claude.com/docs/en/github-actions",
      "title": "Claude Code GitHub Actions",
      "source_type": "documentation",
      "checked_at": "2026-10-11",
      "available": true,
      "official": true
    },
    {
      "source_id": "claude_code_github_changelog",
      "url": "https://raw.githubusercontent.com/anthropics/claude-code/main/CHANGELOG.md",
      "title": "Changelog",
      "source_type": "changelog",
      "checked_at": "2026-10-11",
      "available": true,
      "official": true
    },
    {
      "source_id": "claude_code_gitlab_ci_cd",
      "url": "https://code.claude.com/docs/en/gitlab-ci-cd",
      "title": "Claude Code GitLab CI/CD",
      "source_type": "documentation",
      "checked_at": "2026-10-11",
      "available": true,
      "official": true
    },
    {
      "source_id": "claude_code_headless",
      "url": "https://code.claude.com/docs/en/headless",
      "title": "Run Claude Code programmatically",
      "source_type": "documentation",
      "checked_at": "2026-10-11",
      "available": true,
      "official": true
    },
    {
      "source_id": "claude_code_hooks",
      "url": "https://code.claude.com/docs/en/hooks",
      "title": "Hooks reference",
      "source_type": "documentation",
      "checked_at": "2026-10-11",
      "available": true,
      "official": true
    },
    {
      "source_id": "claude_code_how_it_works",
      "url": "https://code.claude.com/docs/en/how-claude-code-works",
      "title": "How Claude Code works",
      "source_type": "documentation",
      "checked_at": "2026-10-11",
      "available": true,
      "official": true
    },
    {
      "source_id": "claude_code_interactive_mode",
      "url": "https://code.claude.com/docs/en/interactive-mode",
      "title": "Interactive mode",
      "source_type": "documentation",
      "checked_at": "2026-10-11",
      "available": true,
      "official": true
    },
    {
      "source_id": "claude_code_jetbrains",
      "url": "https://code.claude.com/docs/en/jetbrains",
      "title": "JetBrains IDEs",
      "source_type": "documentation",
      "checked_at": "2026-10-11",
      "available": true,
      "official": true
    },
    {
      "source_id": "claude_code_large_codebases",
      "url": "https://code.claude.com/docs/en/large-codebases",
      "title": "Set up Claude Code in a monorepo or large codebase",
      "source_type": "documentation",
      "checked_at": "2026-10-11",
      "available": true,
      "official": true
    },
    {
      "source_id": "claude_code_llm_gateway",
      "url": "https://code.claude.com/docs/en/llm-gateway",
      "title": "Other LLM gateways",
      "source_type": "documentation",